column_name,description,description_bahasa,raw_output
product_name,"This column indicates the name of the product, specifically focusing on types of Wifi services offered.","Kolom ini menunjukkan nama produk, secara khusus berfokus pada jenis layanan WiFi yang ditawarkan.","product_name: This column indicates the name of the product, specifically focusing on types of Wifi services offered."
last_update,"This column records the timestamp of the last update made to the service order, formatted as 'DD/MM/YY HH.MM'.","Kolom ini mencatat cap waktu pembaruan terakhir yang dibuat untuk pesanan layanan, diformat sebagai 'DD/mm/yy hh.mm'.","last_update: This column records the timestamp of the last update made to the service order, formatted as 'DD/MM/YY HH.MM'."
updated_date,"This column captures the precise datetime of the latest update, including timezone information, which aids in tracking changes over time.","Kolom ini menangkap datetime yang tepat dari pembaruan terbaru, termasuk Informasi TimeZone, yang membantu dalam melacak perubahan dari waktu ke waktu.","updated_date: This column captures the precise datetime of the latest update, including timezone information, which aids in tracking changes over time."
sid,"The 'sid' column serves as a unique identifier for each service order, distinguishing different transactions within the dataset.","Kolom 'SID' berfungsi sebagai pengidentifikasi unik untuk setiap pesanan layanan, membedakan transaksi yang berbeda dalam dataset.","sid: The 'sid' column serves as a unique identifier for each service order, distinguishing different transactions within the dataset."
ncx,"This column represents an associated identifier or status related to the product or service, with sample values indicating binary or categorical outcomes.","Kolom ini mewakili pengidentifikasi atau status terkait yang terkait dengan produk atau layanan, dengan nilai sampel yang menunjukkan hasil biner atau kategorikal.","ncx: This column represents an associated identifier or status related to the product or service, with sample values indicating binary or categorical outcomes."
oss,"This column likely indicates the operational status or presence of a product in the OSS system, as suggested by example values like '0' and '1'.","Kolom ini kemungkinan menunjukkan status operasional atau keberadaan produk dalam sistem OSS, seperti yang disarankan oleh nilai contoh seperti '0' dan '1'.","oss: This column likely indicates the operational status or presence of a product in the OSS system, as suggested by example values like '0' and '1'."
tibs,"This column appears to represent the operational status or availability of a product within the TIBS system, with example values showing a binary distinction.","Kolom ini tampaknya mewakili status operasional atau ketersediaan suatu produk dalam sistem TIBS, dengan nilai contoh menunjukkan perbedaan biner.","tibs: This column appears to represent the operational status or availability of a product within the TIBS system, with example values showing a binary distinction."
product_ncx,"This column contains the name of the product in the NCX system, with 'ASTINet' as a consistent example value across entries.","Kolom ini berisi nama produk dalam sistem NCX, dengan 'Astinet' sebagai nilai contoh yang konsisten di seluruh entri.","product_ncx: This column contains the name of the product in the NCX system, with 'ASTINet' as a consistent example value across entries."
product_tibs,"This column provides product names as recognized in the TIBS system, with variations such as 'Telkom ASTINET' and 'ASTINet' noted in the examples.","Kolom ini memberikan nama produk sebagaimana diakui dalam sistem TIBS, dengan variasi seperti 'Telkom Astinet' dan 'Astinet' mencatat dalam contoh.","product_tibs: This column provides product names as recognized in the TIBS system, with variations such as 'Telkom ASTINET' and 'ASTINet' noted in the examples."
product_oss,"This column lists product identifiers used in the OSS system, with all entries showing the example value 'Wifi_RFS'.","Kolom ini mencantumkan pengidentifikasi produk yang digunakan dalam sistem OSS, dengan semua entri menunjukkan nilai contoh 'wifi_rfs'.","product_oss: This column lists product identifiers used in the OSS system, with all entries showing the example value 'Wifi_RFS'."
divisi,"This column likely represents different divisions or departments in the organization, as suggested by example values like 'UNSE' and 'DSS'.","Kolom ini kemungkinan mewakili divisi atau departemen yang berbeda dalam organisasi, seperti yang disarankan oleh nilai -nilai contoh seperti 'unse' dan 'DSS'.","divisi: This column likely represents different divisions or departments in the organization, as suggested by example values like 'UNSE' and 'DSS'."
segmen,"This column seems to categorize the service orders into different segments or markets, such as 'CGS' and 'MANUFACTURE AND INFRASTRUCTURE'.","Kolom ini tampaknya mengkategorikan pesanan layanan menjadi segmen atau pasar yang berbeda, seperti 'CGS' dan 'manufaktur dan infrastruktur'.","segmen: This column seems to categorize the service orders into different segments or markets, such as 'CGS' and 'MANUFACTURE AND INFRASTRUCTURE'."
ncx_order_num,"This column indicates the unique order number for transactions in the NCX system, with examples like '1-407971990'.","Kolom ini menunjukkan nomor pesanan unik untuk transaksi dalam sistem NCX, dengan contoh seperti '1-407971990'.","ncx_order_num: This column indicates the unique order number for transactions in the NCX system, with examples like '1-407971990'."
ncx_li_milestone,"This column tracks the current milestone status of the order, with values like 'PROVISION START' and 'FULFILL BILLING COMPLETE' indicating different stages of service fulfillment.","Kolom ini melacak status tonggak sejarah saat ini dari pesanan, dengan nilai -nilai seperti 'ketentuan start' dan 'memenuhi penagihan lengkap' yang menunjukkan berbagai tahap pemenuhan layanan.","ncx_li_milestone: This column tracks the current milestone status of the order, with values like 'PROVISION START' and 'FULFILL BILLING COMPLETE' indicating different stages of service fulfillment."
[TOTAL_TOKENS],2270,,
[TIME_ELAPSED_SECONDS],273.12,,
