column_name,description,raw_output
Id,A unique identifier for each house sale entry represented by a numeric string.,Id: A unique identifier for each house sale entry represented by a numeric string.
MSSubClass,"A code representing the building class of the house, indicating its construction style, with example values like '60' and '70'.","MSSubClass: A code representing the building class of the house, indicating its construction style, with example values like '60' and '70'."
MSZoning,"The zoning classification of the property, helping to categorize the land use, with consistent values shown as 'RL'.","MSZoning: The zoning classification of the property, helping to categorize the land use, with consistent values shown as 'RL'."
LotFrontage,"The linear measurement of the property frontage, illustrated with values like '65.0' and '80.0', indicating the amount of street exposure.","LotFrontage: The linear measurement of the property frontage, illustrated with values like '65.0' and '80.0', indicating the amount of street exposure."
LotArea,"The total area of the property lot in square feet, with examples such as '8450' and '14260', relevant for market value assessment.","LotArea: The total area of the property lot in square feet, with examples such as '8450' and '14260', relevant for market value assessment."
Street,"Indicates the type of street access to the property, consistently shown as 'Pave', suggesting a paved road.","Street: Indicates the type of street access to the property, consistently shown as 'Pave', suggesting a paved road."
Alley,"Specifies the accessibility via alleyways, also represented as 'Pave', indicating a consistent type of alley access across entries.","Alley: Specifies the accessibility via alleyways, also represented as 'Pave', indicating a consistent type of alley access across entries."
LotShape,"A code representing the shape of the lot, with values like 'Reg' for regular and 'IR1' for irregular lots impacting layout and usability.","LotShape: A code representing the shape of the lot, with values like 'Reg' for regular and 'IR1' for irregular lots impacting layout and usability."
LandContour,"Describes the topographical layout of the land, consistently represented as 'Lvl' indicating a level terrain, which can influence construction and landscaping choices.","LandContour: Describes the topographical layout of the land, consistently represented as 'Lvl' indicating a level terrain, which can influence construction and landscaping choices."
Utilities,"This column indicates the type of utilities available for the house, with 'AllPub' suggesting full public utilities are present.","Utilities: This column indicates the type of utilities available for the house, with 'AllPub' suggesting full public utilities are present."
LotConfig,"This column describes the configuration of the lot, with values like 'Inside' and 'Corner' indicating its placement within a neighborhood.","LotConfig: This column describes the configuration of the lot, with values like 'Inside' and 'Corner' indicating its placement within a neighborhood."
LandSlope,"This column captures the slope of the land, with 'Gtl' representing gentle slopes that may affect drainage and building stability.","LandSlope: This column captures the slope of the land, with 'Gtl' representing gentle slopes that may affect drainage and building stability."
Neighborhood,"This column specifies the neighborhood designation, with values like 'CollgCr' and 'Veenker', which can influence property values and desirability.","Neighborhood: This column specifies the neighborhood designation, with values like 'CollgCr' and 'Veenker', which can influence property values and desirability."
Condition1,"This column denotes the general condition of the property relative to its surroundings, with 'Norm' indicating normal or typical conditions.","Condition1: This column denotes the general condition of the property relative to its surroundings, with 'Norm' indicating normal or typical conditions."
Condition2,"Similar to Condition1, this column also assesses the property's condition but is used when there are multiple conditions present, often uniformly marked as 'Norm'.","Condition2: Similar to Condition1, this column also assesses the property's condition but is used when there are multiple conditions present, often uniformly marked as 'Norm'."
BldgType,"This column categorizes the type of building, with '1Fam' indicating a single-family residential property.","BldgType: This column categorizes the type of building, with '1Fam' indicating a single-family residential property."
HouseStyle,"This column outlines the architectural style of the house, with values such as '2Story' and '1Story', suggesting differences in layout and potential market appeal.","HouseStyle: This column outlines the architectural style of the house, with values such as '2Story' and '1Story', suggesting differences in layout and potential market appeal."
OverallQual,"This column evaluates the overall quality of the house, expressed as a numerical rating, with higher numbers like '7' and '8' indicating better quality features and finishes.","OverallQual: This column evaluates the overall quality of the house, expressed as a numerical rating, with higher numbers like '7' and '8' indicating better quality features and finishes."
OverallCond,"This column represents the overall condition of the house, with example values indicating a rating scale from 1 to 10, where ‘8’ suggests better condition than ‘5’.","OverallCond: This column represents the overall condition of the house, with example values indicating a rating scale from 1 to 10, where ‘8’ suggests better condition than ‘5’."
YearBuilt,"This column indicates the year the house was originally built, with values like '2003' and '1915' revealing the age of the properties.","YearBuilt: This column indicates the year the house was originally built, with values like '2003' and '1915' revealing the age of the properties."
YearRemodAdd,"This column records the year of the most recent remodeling or addition, which may help assess the house's updated features in relation to its built year.","YearRemodAdd: This column records the year of the most recent remodeling or addition, which may help assess the house's updated features in relation to its built year."
RoofStyle,"This column specifies the style of the roof, with all example values being 'Gable', suggesting a consistent roof design across these properties.","RoofStyle: This column specifies the style of the roof, with all example values being 'Gable', suggesting a consistent roof design across these properties."
RoofMatl,"This column denotes the material used for the roof, where 'CompShg' indicates that all sample houses use composite shingles for roofing.","RoofMatl: This column denotes the material used for the roof, where 'CompShg' indicates that all sample houses use composite shingles for roofing."
Exterior1st,"This column describes the primary exterior material of the house, with examples like 'VinylSd' indicating a common usage of vinyl siding.","Exterior1st: This column describes the primary exterior material of the house, with examples like 'VinylSd' indicating a common usage of vinyl siding."
Exterior2nd,"This column lists the secondary exterior material, which is similar to Exterior1st, with variations such as 'Wd Shng' noted in the samples.","Exterior2nd: This column lists the secondary exterior material, which is similar to Exterior1st, with variations such as 'Wd Shng' noted in the samples."
MasVnrType,"This column identifies the type of masonry veneer on the house, with example values like 'BrkFace' illustrating common masonry choices.","MasVnrType: This column identifies the type of masonry veneer on the house, with example values like 'BrkFace' illustrating common masonry choices."
MasVnrArea,"This column quantifies the area of the masonry veneer in square feet, with numerical values such as '196.0' suggesting varying extents of masonry application.","MasVnrArea: This column quantifies the area of the masonry veneer in square feet, with numerical values such as '196.0' suggesting varying extents of masonry application."
ExterQual,"This column indicates the quality of the exterior material of the house, with values like 'Gd' and 'TA' suggesting good and typical quality, respectively.","ExterQual: This column indicates the quality of the exterior material of the house, with values like 'Gd' and 'TA' suggesting good and typical quality, respectively."
ExterCond,"This column reflects the condition of the exterior material, with consistent values like 'TA' indicating typical condition across the dataset.","ExterCond: This column reflects the condition of the exterior material, with consistent values like 'TA' indicating typical condition across the dataset."
Foundation,"This column specifies the type of foundation used in the house, with example values such as 'PConc' and 'CBlock' denoting different foundation materials.","Foundation: This column specifies the type of foundation used in the house, with example values such as 'PConc' and 'CBlock' denoting different foundation materials."
BsmtQual,"This column denotes the quality of the basement, with values like 'Gd' and 'TA' indicating good quality and typical quality levels.","BsmtQual: This column denotes the quality of the basement, with values like 'Gd' and 'TA' indicating good quality and typical quality levels."
BsmtCond,"This column represents the condition of the basement, with entries such as 'TA' and 'Gd' reflecting its condition as typical or good.","BsmtCond: This column represents the condition of the basement, with entries such as 'TA' and 'Gd' reflecting its condition as typical or good."
BsmtExposure,"This column describes the exposure of the basement to the outside, illustrated by values like 'No', 'Gd', and 'Mn', which indicate no exposure, good exposure, and minimum exposure, respectively.","BsmtExposure: This column describes the exposure of the basement to the outside, illustrated by values like 'No', 'Gd', and 'Mn', which indicate no exposure, good exposure, and minimum exposure, respectively."
BsmtFinType1,"This column identifies the finish type of the basement's primary area, with values like 'GLQ' and 'ALQ' indicating a good living quality or an average living quality finish.","BsmtFinType1: This column identifies the finish type of the basement's primary area, with values like 'GLQ' and 'ALQ' indicating a good living quality or an average living quality finish."
BsmtFinSF1,"This column measures the square footage of the finished portion of the basement, with example values such as '706.0' and '978.0' providing quantifiable data on space.","BsmtFinSF1: This column measures the square footage of the finished portion of the basement, with example values such as '706.0' and '978.0' providing quantifiable data on space."
BsmtFinType2,"This column specifies the finish type of the basement's secondary area, with repetitive values like 'Unf' indicating an unfinished status across all samples.","BsmtFinType2: This column specifies the finish type of the basement's secondary area, with repetitive values like 'Unf' indicating an unfinished status across all samples."
BsmtFinSF2,"This column represents the square footage of finished basement area, with all example values indicating no finished basement space.","BsmtFinSF2: This column represents the square footage of finished basement area, with all example values indicating no finished basement space."
BsmtUnfSF,"This column indicates the square footage of unfinished basement area, with values ranging from 150.0 to 540.0 square feet.","BsmtUnfSF: This column indicates the square footage of unfinished basement area, with values ranging from 150.0 to 540.0 square feet."
TotalBsmtSF,"This column describes the total square footage of the basement, combining both finished and unfinished areas, with example values reflecting totals between 756.0 and 1262.0 square feet.","TotalBsmtSF: This column describes the total square footage of the basement, combining both finished and unfinished areas, with example values reflecting totals between 756.0 and 1262.0 square feet."
Heating,"This column specifies the type of heating system used in the house, with all examples indicating a 'GasA' heating system.","Heating: This column specifies the type of heating system used in the house, with all examples indicating a 'GasA' heating system."
HeatingQC,"This column rates the overall quality of the heating system, with example values showing a range from 'Gd' (Good) to 'Ex' (Excellent).","HeatingQC: This column rates the overall quality of the heating system, with example values showing a range from 'Gd' (Good) to 'Ex' (Excellent)."
CentralAir,"This column indicates whether the house has central air conditioning, with all sample values confirming the presence of air conditioning ('Y').","CentralAir: This column indicates whether the house has central air conditioning, with all sample values confirming the presence of air conditioning ('Y')."
Electrical,"This column denotes the type of electrical system in the house, with all examples indicating 'SBrkr', which typically refers to a standardized breaker system.","Electrical: This column denotes the type of electrical system in the house, with all examples indicating 'SBrkr', which typically refers to a standardized breaker system."
1stFlrSF,"This column represents the square footage of the first floor, with example values indicating significant variability from 856 to 1262 square feet.","1stFlrSF: This column represents the square footage of the first floor, with example values indicating significant variability from 856 to 1262 square feet."
2ndFlrSF,"This column indicates the square footage of the second floor, with values ranging from 0 to 1053 square feet, suggesting some houses may not have a second floor.","2ndFlrSF: This column indicates the square footage of the second floor, with values ranging from 0 to 1053 square feet, suggesting some houses may not have a second floor."
LowQualFinSF,"This column indicates the area (in square feet) of the house that is categorized as low quality, with example values of '0' suggesting no low-quality finishing.","LowQualFinSF: This column indicates the area (in square feet) of the house that is categorized as low quality, with example values of '0' suggesting no low-quality finishing."
GrLivArea,"This represents the above-ground living area size in square feet, with example values like '1710' indicating the total living space available.","GrLivArea: This represents the above-ground living area size in square feet, with example values like '1710' indicating the total living space available."
BsmtFullBath,"This column records the number of full bathrooms in the basement, with values like '1.0' showing that some houses include a full bath below ground.","BsmtFullBath: This column records the number of full bathrooms in the basement, with values like '1.0' showing that some houses include a full bath below ground."
BsmtHalfBath,"This indicates the number of half bathrooms in the basement, with example values such as '0.0' suggesting some properties lack half baths down below.","BsmtHalfBath: This indicates the number of half bathrooms in the basement, with example values such as '0.0' suggesting some properties lack half baths down below."
FullBath,"This represents the total number of full bathrooms in the house, illustrated by example values like '2', demonstrating a common bathroom configuration.","FullBath: This represents the total number of full bathrooms in the house, illustrated by example values like '2', demonstrating a common bathroom configuration."
HalfBath,"This indicates the number of half bathrooms above ground, where values like '1' show that some homes have additional half baths.","HalfBath: This indicates the number of half bathrooms above ground, where values like '1' show that some homes have additional half baths."
BedroomAbvGr,"This column denotes the number of bedrooms above ground, with values like '3' indicating a typical count in residential properties.","BedroomAbvGr: This column denotes the number of bedrooms above ground, with values like '3' indicating a typical count in residential properties."
KitchenAbvGr,"This records the number of kitchens above ground, and all example values being '1' suggest that homes usually have one kitchen.","KitchenAbvGr: This records the number of kitchens above ground, and all example values being '1' suggest that homes usually have one kitchen."
KitchenQual,"This represents the quality rating of the kitchen, with example values such as 'Gd' (Good), indicating varying levels of kitchen quality across properties.","KitchenQual: This represents the quality rating of the kitchen, with example values such as 'Gd' (Good), indicating varying levels of kitchen quality across properties."
TotRmsAbvGrd,"Represents the total number of rooms above ground level, with example values ranging from 6 to 9 indicating varying house sizes.","TotRmsAbvGrd: Represents the total number of rooms above ground level, with example values ranging from 6 to 9 indicating varying house sizes."
Functional,"Indicates the functional condition of the house, with all examples being 'Typ' signifying a typical functional state.","Functional: Indicates the functional condition of the house, with all examples being 'Typ' signifying a typical functional state."
Fireplaces,"Represents the number of fireplaces in the house, as shown in example values ranging from 0 to 1, indicating homes with no or one fireplace.","Fireplaces: Represents the number of fireplaces in the house, as shown in example values ranging from 0 to 1, indicating homes with no or one fireplace."
FireplaceQu,"Describes the quality of the fireplace, with example values like 'Gd' (Good) and 'TA' (Typical), providing insights into potential comfort or aesthetic appeal.","FireplaceQu: Describes the quality of the fireplace, with example values like 'Gd' (Good) and 'TA' (Typical), providing insights into potential comfort or aesthetic appeal."
GarageType,"Specifies the type of garage attached or detached to the property, with example values indicating a mix of 'Attchd' (Attached) and 'Detchd' (Detached) garages.","GarageType: Specifies the type of garage attached or detached to the property, with example values indicating a mix of 'Attchd' (Attached) and 'Detchd' (Detached) garages."
GarageYrBlt,"Indicates the year the garage was built, with examples showing a range from 1976 to 2003, helping to assess the age of garage structures.","GarageYrBlt: Indicates the year the garage was built, with examples showing a range from 1976 to 2003, helping to assess the age of garage structures."
GarageFinish,"Describes the finish of the garage interior, where examples like 'RFn' ( Rated Finished) suggest varying levels of completion in garage spaces.","GarageFinish: Describes the finish of the garage interior, where examples like 'RFn' ( Rated Finished) suggest varying levels of completion in garage spaces."
GarageCars,"Represents the number of cars the garage can accommodate, with example values showing capacity ranging from 2 to 3 cars.","GarageCars: Represents the number of cars the garage can accommodate, with example values showing capacity ranging from 2 to 3 cars."
GarageArea,"Indicates the size of the garage in square feet, with example values ranging from 460 to 836, reflecting the space available for vehicles and storage.","GarageArea: Indicates the size of the garage in square feet, with example values ranging from 460 to 836, reflecting the space available for vehicles and storage."
GarageQual,"This column indicates the quality of the garage, with all example values being 'TA' suggesting typical quality.","GarageQual: This column indicates the quality of the garage, with all example values being 'TA' suggesting typical quality."
GarageCond,"This column reflects the condition of the garage, with all example values showing 'TA', indicating typical condition.","GarageCond: This column reflects the condition of the garage, with all example values showing 'TA', indicating typical condition."
PavedDrive,"This column specifies whether the driveway is paved, with all examples showing 'Y', indicating a yes for paved driveways.","PavedDrive: This column specifies whether the driveway is paved, with all examples showing 'Y', indicating a yes for paved driveways."
WoodDeckSF,"This column represents the square footage of any wooden deck, with example values ranging from '0' to '298', indicating variability in deck sizes.","WoodDeckSF: This column represents the square footage of any wooden deck, with example values ranging from '0' to '298', indicating variability in deck sizes."
OpenPorchSF,"This column denotes the square footage of open porches, with example values illustrating sizes from '0' to '84'.","OpenPorchSF: This column denotes the square footage of open porches, with example values illustrating sizes from '0' to '84'."
EnclosedPorch,"This column captures the square footage of enclosed porches, with values such as '0' or '272', indicating the presence or absence of enclosed porches.","EnclosedPorch: This column captures the square footage of enclosed porches, with values such as '0' or '272', indicating the presence or absence of enclosed porches."
3SsnPorch,"This column indicates the square footage of three-season porches, with all values being '0', indicating none are present.","3SsnPorch: This column indicates the square footage of three-season porches, with all values being '0', indicating none are present."
ScreenPorch,"This column reflects the square footage of screened porches, with all example values showing '0', suggesting none are included.","ScreenPorch: This column reflects the square footage of screened porches, with all example values showing '0', suggesting none are included."
PoolArea,"This column represents the area allocated for a pool, with all values being '0', indicating no pools are present in the properties.","PoolArea: This column represents the area allocated for a pool, with all values being '0', indicating no pools are present in the properties."
PoolQC,"This column indicates the quality of the pool in the property, with example values such as 'Ex' suggesting excellent quality.","PoolQC: This column indicates the quality of the pool in the property, with example values such as 'Ex' suggesting excellent quality."
Fence,"This column categorizes the type of fence surrounding the property, with example values like 'GdWo' and 'MnPrv' denoting good quality wood and medium privacy, respectively.","Fence: This column categorizes the type of fence surrounding the property, with example values like 'GdWo' and 'MnPrv' denoting good quality wood and medium privacy, respectively."
MiscFeature,"This column lists additional miscellaneous features of the property, where example values such as 'Shed' indicate the presence of a shed.","MiscFeature: This column lists additional miscellaneous features of the property, where example values such as 'Shed' indicate the presence of a shed."
MiscVal,"This column provides the monetary value associated with miscellaneous features, with example values like '0' suggesting there may be no additional value attributed.","MiscVal: This column provides the monetary value associated with miscellaneous features, with example values like '0' suggesting there may be no additional value attributed."
MoSold,"This column represents the month in which the house was sold, with example values like '2' indicating sales occurring in February.","MoSold: This column represents the month in which the house was sold, with example values like '2' indicating sales occurring in February."
YrSold,"This column captures the year the property was sold, with example values such as '2008' showing sale years.","YrSold: This column captures the year the property was sold, with example values such as '2008' showing sale years."
SaleType,"This column describes the type of sale for the property, with example values like 'WD' indicating a warranty deed sale.","SaleType: This column describes the type of sale for the property, with example values like 'WD' indicating a warranty deed sale."
SaleCondition,"This column denotes the condition under which the sale occurred, with example values like 'Normal' indicating a normal sale condition.","SaleCondition: This column denotes the condition under which the sale occurred, with example values like 'Normal' indicating a normal sale condition."
SalePrice,"This column holds the selling price of the property, with example values like '208500.0' reflecting the final sale amount.","SalePrice: This column holds the selling price of the property, with example values like '208500.0' reflecting the final sale amount."
[TOTAL_TOKENS],8038,
[TIME_ELAPSED_SECONDS],35.78,
